{
  "status": "escalation_needed",
  "phase": "verify_task",
  "runner": "hermes",
  "issue_number": 502,
  "scope_summary": "Verify the implemented slice against repo-local quality gates.",
  "non_goals": [
    "fix the underlying test failure (out of slice; needs a dependency upgrade)"
  ],
  "acceptance_criteria_results": [
    {
      "criterion": "pnpm test passes.",
      "result": "fail",
      "evidence": "vitest reports 3 failures in plugins/memory/src/graph/store.test.ts"
    }
  ],
  "changed_files": [],
  "verification_commands": [
    "pnpm test",
    "pnpm typecheck"
  ],
  "verification_results": [
    {
      "command": "pnpm test",
      "exit_code": 1,
      "summary": "3 failing in plugins/memory/src/graph/store.test.ts: timeouts against RedDB local instance"
    },
    {
      "command": "pnpm typecheck",
      "exit_code": 0,
      "summary": "clean"
    }
  ],
  "quality_gate_failures": [
    "vitest: graph/store.test.ts ECONNREFUSED localhost:7770 (RedDB not booted in this sandbox)"
  ],
  "blocker_reason": null,
  "next_human_action": "Re-route this issue to a runner that can boot a local RedDB (claude with the test-runner harness) or pre-seed RedDB in CI.",
  "remaining_risks": [
    "The failure may also affect any in-flight memory-plugin slices in the same drain."
  ],
  "confidence": "medium",
  "raw_runner_output_path": null
}
