{
  "status": "completed",
  "phase": "execute_task",
  "runner": "claude",
  "issue_number": 205,
  "scope_summary": "Add the runner-neutral AFK task contract schema, fixtures, and structural validator under .red/contracts/.",
  "non_goals": [
    "rewire /afk to emit or consume the envelope (deferred to #199-#202)",
    "introduce a .codex-plugin/agents/ directory"
  ],
  "acceptance_criteria_results": [
    {
      "criterion": "A tracked contract/schema exists for runner-neutral AFK phase inputs and outputs.",
      "result": "pass",
      "evidence": ".red/contracts/afk-task.md + afk-task.schema.json"
    },
    {
      "criterion": "The contract has fixtures/tests for well-formed completed, blocked, escalation, malformed JSON, missing fields, and hollow-success outputs.",
      "result": "pass",
      "evidence": ".red/contracts/fixtures/afk-task/{valid,invalid}/*"
    }
  ],
  "changed_files": [
    ".red/contracts/afk-task.md",
    ".red/contracts/afk-task.schema.json",
    "scripts/validate-afk-task-contract.sh"
  ],
  "verification_commands": [
    "scripts/test-validate-afk-task-contract.sh"
  ],
  "verification_results": [
    {
      "command": "scripts/test-validate-afk-task-contract.sh",
      "exit_code": 0,
      "summary": "6/6 fixtures pass"
    }
  ],
  "quality_gate_failures": [],
  "blocker_reason": null,
  "next_human_action": null,
  "remaining_risks": [
    "Downstream #199-#202 may discover the schema needs additional fields once real envelopes are emitted."
  ],
  "confidence": "high",
  "raw_runner_output_path": ".red/tmp/work-wD3GX-i205/runner-output.jsonl"
}
